ID,boxoffice_todate,countries,directors,dvd_release,imdbID,imdbRating,imdbVotes,langs,mpaa_rating,plot,poster_url,prodco,release_date,release_year,runtime,title,actors,watched,genres,writers
103,0,USA,Michael Bay,#N/A,tt3371366,0,0,English,#N/A,"Humans and Transformers are at war, Optimus Prime is gone. The key to saving our future lies buried in the secrets of the past, in the hidden history of Transformers on Earth.",https://images-na.ssl-images-amazon.com/images/M/MV5BMjMwMzM4NTE5OV5BMl5BanBnXkFtZTgwMTAwNDU4MDI@._V1_SX300.jpg,Paramount Pictures,6/23/2017,2017,#N/A,Transformers: The Last Knight,Gemma Chan|Mark Wahlberg|Stanley Tucci|Anthony Hopkins,1,Action|Adventure|Sci-Fi,Art Marcum |Matt Holloway |Ken Nolan |Art Marcum |Ken Nolan |Akiva Goldsman |Matt Holloway 
104,0,USA,John Dahl,6/4/2002,tt0118040,6,4140,English|Spanish,R,"Unsuccessfully framed for his wife's murder, Dr. David Krane attempts to find the real culprit by utilizing a new drug that allows him to experience the memories of other people first-hand....",https://images-na.ssl-images-amazon.com/images/M/MV5BMjE4MjA4MzIxMV5BMl5BanBnXkFtZTcwMTg3Mjg3NA@@._V1_SX300.jpg,MGM Home Entertainment,2/23/1996,1996,117 min,Unforgettable,Ray Liotta|Linda Fiorentino|Peter Coyote|Christopher McDonald,1,Drama|Mystery|Sci-Fi,Bill Geddie
105,0,UK,Michael Caton-Jones,5/12/2017,tt2184335,6.2,175,English,#N/A,"Urban Hymn follows a troubled teenage girl, Jamie, who possesses an amazing singing voice, and an inspiring and unconventional social worker, Kate, who encourages her to use it.",https://images-na.ssl-images-amazon.com/images/M/MV5BZjkwYzVlZjEtM2M4Yi00NThiLTg1ZjUtMjAxMWRhMjgzYzY2XkEyXkFqcGdeQXVyNDg3MTQxOTg@._V1_SX300.jpg,Level 33 Entertainment,5/12/2017,2015,114 min,Urban Hymn,Shirley Henderson|Ian Hart|Jack McMullen|Steven Mackintosh,0,Crime|Drama,Nick Moorcroft
106,0,USA|Italy,Eric D. Howell,#N/A,tt1544608,5.4,1811,English,R,"Set in 1950s Tuscany, Voice from the Stone is the haunting and suspenseful story of Verena, a solemn nurse drawn to aid a young boy who has fallen silent since the sudden passing of his mother.",https://images-na.ssl-images-amazon.com/images/M/MV5BNzQzNzc2MDQ3OF5BMl5BanBnXkFtZTgwNTU2NzU2MTI@._V1_SX300.jpg,#N/A,4/28/2017,2017,94 min,Voice from the Stone,Emilia Clarke|Marton Csokas|Caterina Murino|Kate Linder,1,Drama|Mystery|Thriller,Silvio Raffo |Andrew Shaw 
107,0,USA,Robin Swicord,#N/A,tt5195412,7,121,English,#N/A,A man's nervous breakdown causes him to leave his wife and live in his attic for several months.,https://images-na.ssl-images-amazon.com/images/M/MV5BMWYxZDM0MWItMTk5MC00ZWI3LWI1MTQtZDA2NmZlNDgyMTJiXkEyXkFqcGdeQXVyNTE1NzkxNzU@._V1_SX300.jpg,IFC Films,6/15/2017,2016,106 min,Wakefield,Bryan Cranston|Jennifer Garner|Jason O'Mara|Beverly D'Angelo,1,Drama,Robin Swicord
108,0,USA,Henry King,#N/A,tt0037465,6.9,1122,English,UNRATED,A chronicle of the political career of US President Woodrow Wilson.,https://images-na.ssl-images-amazon.com/images/M/MV5BMjEyMDcwODY0Ml5BMl5BanBnXkFtZTcwMTM3NzQyMQ@@._V1_SX300.jpg,Twentieth Century Fox Film Cor,8/1/1945,1944,154 min,Wilson,Alexander Knox|Geraldine Fitzgerald|Thomas Mitchell|Ruth Nelson,1,Biography|Drama|History,Lamar Trotti 
109,0,USA,Lauren Montgomery,#N/A,tt1186373,7.4,12142,English,PG-13,A modern man's trespass of the island of the Amazons enables an imprisoned war god to escape and Princess Diana wins the responsibility to recapture him.,https://images-na.ssl-images-amazon.com/images/M/MV5BNzU1NmNmNTgtMTUyYS00ZmRmLTkzOWItOTY2ZWZiYjVkYzkzXkEyXkFqcGdeQXVyNjExODE1MDc@._V1_SX300.jpg,Laguna Productions,3/3/2009,2009,74 min,Wonder Woman,Keri Russell|Nathan Fillion|Alfred Molina|Rosario Dawson,0,Animation|Action|Adventure,William Moulton Marston |Gail Simone |Michael Jelenic |Michael Jelenic 
110,0,USA,Alexander Janko,#N/A,tt4068586,8.2,40,English,#N/A,"Hoping to reclaim who she was before marriage and children, an empty nester retreats to Cape Cod where she embarks upon a quest to set herself free.",https://images-na.ssl-images-amazon.com/images/M/MV5BMTgwNTk1ODMxMF5BMl5BanBnXkFtZTgwMTQ3NDQ1MTI@._V1_SX300.jpg,Real Women Make Waves,2/24/2017,2016,114 min,Year by the Sea,Monique Gabriela Curnen|Karen Allen|Yannick Bisson|Celia Imrie,0,Comedy|Drama|Romance,Joan Anderson |Alexander Janko |Alexander Janko
